Network,FamilyName,Alias,FamilyRoleOrder,Instance,LinkNo,LinkNetwork,LinkAlias,LinkDesc
Trancendence,Protagonist,Tate H,8,6,1,Prominence,Richard G,Lead he backs. Asks the question that saves plans.
Trancendence,Protagonist,Tate H,8,6,2,Prominence,Oliver F,Spreadsheet captain. Tate supplies reality checks.
Trancendence,Protagonist,Tate H,8,6,3,Prominence,Ryan D,Systems whisperer. Tate flags failure points.
Trancendence,Protagonist,Tate H,8,6,4,Prominence,Sam S,Ground crew. PPE enforcer and steady hand.
Trancendence,Protagonist,Tate H,8,6,5,Prominence,Tommy W,Entry-exit partner. Tate plans routes; Tommy clears them.
Trancendence,Protagonist,Tate H,8,6,6,Prominence,Codey S,Hobby link. Trades model tips and laughs.
Trancendence,Protagonist,Tate H,8,6,7,Prominence,Dan D,Non-work anchor. LARP nights and kit builds.
Trancendence,Protagonist,Tate H,8,6,8,Prominence,Brick D,Quiet boundary. Earns respect without provoking.
Trancendence,Protagonist,Tate H,8,6,9,Transcendence,Bram W,"Bram treats Tate like a professional, not a mascot; Tate pays it back by showing up early and making hard rooms easier."
Trancendence,Protagonist,Tate H,8,6,10,Imperium,Logan X,Tate trusts Logan’s read of a room. Even disagreements stay clean.
Trancendence,Protagonist,Benedict C,8,7,1,Eloquence,Tony M,"Meals, logistics, and a steady place to regroup. Tony supports Ben’s work without turning it into a performance."
Trancendence,Protagonist,Benedict C,8,7,2,Eloquence,Justin S,Justin handles the plan; Ben handles the people. They work cleanly because they don’t compete for credit.
Trancendence,Protagonist,Benedict C,8,7,3,Eloquence,Rodnar R,"Rodnar respects Ben’s practicality. Ben respects Rodnar’s duty, even when it’s inconvenient."
Trancendence,Protagonist,Benedict C,8,7,4,Eloquence,John P,John keeps the records of what the community survived; Ben keeps the community from breaking in the first place.
Trancendence,Protagonist,Benedict C,8,7,5,Eloquence,Karter H,Ben sees Karter’s potential under the noise. Karter listens because Ben never tries to win an argument.
Trancendence,Protagonist,Benedict C,8,7,6,Eloquence,Peter G,Ben checks on Peter like it matters. That small care becomes a real anchor during stressful nights.
Trancendence,Protagonist,Benedict C,8,7,7,Eloquence,Joe B,Ben trusts Joe with small responsibilities; Joe rises to meet them without being asked twice.
Trancendence,Protagonist,Benedict C,8,7,8,Eloquence,Xano D,A shared ‘earned it’ worldview. Xano and Ben understand each other without translating.
Trancendence,Protagonist,Benedict C,8,7,9,Transcendence,Bram W,Bram respects Benedict’s quiet authority; Benedict respects Bram’s willingness to carry blame so others can keep working.
Trancendence,Protagonist,Benedict C,8,7,10,Opulence,Juan L,Benedict likes how Juan stays steady. It makes the time together feel simpler.
Trancendence,Protagonist,Thomas B,8,8,1,Imperium,Logan X,"Thomas recognizes Logan as part of the house’s shadow economy. He watches him closely, waiting to see which way Logan breaks under pressure."
Trancendence,Protagonist,Thomas B,8,8,2,Imperium,Josh R,"Josh is the kind of civilian Thomas tries to keep alive: talented, anxious, and in the wrong place at the wrong time. Thomas stays near him when danger starts circling."
Trancendence,Protagonist,Thomas B,8,8,3,Imperium,Kyle M,Kyle knows routes and rhythms most people ignore. Thomas trusts that kind of local sense when a situation stops being predictable.
Trancendence,Protagonist,Thomas B,8,8,4,Imperium,Luke C,Luke is orderly in a city that isn’t. Thomas respects that—and uses Luke’s documentation when the official story starts twisting.
Trancendence,Protagonist,Thomas B,8,8,5,Imperium,Zack D,Zack is the house’s muscle and its liability. Thomas keeps him in his peripheral vision the way you track a weapon you can’t confiscate.
Trancendence,Protagonist,Thomas B,8,8,6,Imperium,Chase A,"Chase is the lab brain Thomas would rather not need. When he does need him, Thomas keeps it professional and short."
Trancendence,Protagonist,Thomas B,8,8,7,Imperium,Johnny L,Johnny attracts attention like a magnet. Thomas uses that when it helps and shuts it down when it doesn’t.
Trancendence,Protagonist,Thomas B,8,8,8,Imperium,Ryan L,"Ryan’s chaos can ruin a scene or save it. Thomas treats him like a variable and keeps moving, even when the nickname ‘Charlie’ slips out."
Trancendence,Protagonist,Thomas B,8,8,9,Transcendence,Bram W,Bram doesn’t ask Thomas for a convenient version; he asks for the version that holds up after the city calms down.
Trancendence,Protagonist,Thomas B,8,8,10,Prominence,Sam S,"Thomas and Sam keep it light: quick banter, mutual respect, and no pressure to perform."
